{
  "schema_version": "1.0.0",
  "venue": "polymarket",
  "source_trade_id": "dataapi:0f1e2d3c0f1e2d3c0f1e2d3c0f1e2d3c0f1e2d3c0f1e2d3c0f1e2d3c0f1e2d3c",
  "wallet": "0x8f7a2b1c3d4e5f6a7b8c9d0e1f2a3b4c5d6e7f80",
  "condition_id": "0x9c1a7f3e5d2b8c4a6f0e9d1c3b5a7f2e4d6c8b0a9f1e3d5c7b2a4f6e8d0c1b3a",
  "outcome_token_id": "71321045679188491511466125638937967989095212255543834095860404600128",
  "side": "BUY",
  "price": "0.34",
  "quantity": "1500.5",
  "notional": "510.17",
  "occurred_at": "2026-07-30T14:22:05Z",
  "tx_hash": "0xa1b2c3d4e5f60718293a4b5c6d7e8f90a1b2c3d4e5f60718293a4b5c6d7e8f90",
  "maker_taker": "taker",
  "raw_object_id": "0b5d1c9e-4a3f-4b2d-9c8e-7f6a5d4c3b2a"
}
